31|||Improving power output for vibration-based energy scavengers|||If pervasive networks of wireless sensor and communication nodes are to achieve their full potential, researchers must develop practical solutions for self-powering these autonomous electronic devices. Batteries, fuel cells, and other fixed energy alternatives are impractical for wireless devices with an expected lifetime of more than 10 years. An alternative is to use devices that generate power by scavenging ambient environment energy. The authors have developed several small vibration-based energy scavengers using piezoelectric materials that can scavenge power from low-level ambient vibration sources. Given appropriate power conditioning and capacitive storage, the resulting power source is sufficient to support networks of ultra-low-power, peer-to-peer wireless nodes. This article describes these devices, as well as device designs that use new, sometimes micro-scale geometries.|||2005
311|||Energy Scavenging For Wireless Sensor Networks With Special Focus On Vibrations|||The vast reduction in size and power consumption of CMOS circuitry has led to a large research effort based around the vision of wireless sensor networks. The proposed networks will be comprised of thousands of small wireless nodes that operate in a multi-hop fashion, replacing long transmission distances with many low power, low cost wireless devices. The result will be the creation of an intelligent environment responding to its inhabitants and ambient conditions. Wireless devices currently being designed and built for use in such environments typically run on batteries. However, as the networks increase in number and the devices decrease in size, the replacement of depleted batteries will not be practical. The cost of replacing batteries in a few devices that make up a small network about once per year is modest. However, the cost of replacing thousands of devices in a single building annually, some of which are in areas difficult to access, is simply not practical. Another approach would be to use a battery that is large enough to last the entire lifetime of the wireless sensor device. However, a battery large enough to last the lifetime of the device would dominate the overall system size and cost, and thus is not very attractive. Alternative methods of powering the devices that will make up the wireless networks are desperately needed.|||2004
312|||Electric-energy generation using variable-capacitive resonator for power-free LSI: efficiency analysis and fundamental experiment|||A power generator based on a vibration-to-electric energy converter using a variable-resonating capacitor is experimentally demonstrated. The generator consists of a complete system with a mechanical-variable capacitor, a charge-transporting LC tank circuit and an externally powered timing-capture controller. A practical design methodology to maximize the efficiency of the vibration-to-electric energy generation system is also described. The efficiency of the generator is estimated based on three factors: the mechanical-energy loss, the charge-transportation loss, and the timing-capture loss. Through the mechanical-energy analysis, the optimum condition for the resonance is found. The parasitic elements in the charge transporter and the timing management of the capture scheme dominate the generation efficiency. These analyses enable the optimum design of the energy-generation system. An experimentally fabricated and measured generator theoretically has a maximum power of 580 nW; the measured power is 120 nW, so conversion efficiency is 21%. This results from a 43% mechanical-energy loss and a 63% charge-transportation loss. The timing-capture scheme is manually determined and externally powered in the experiment, so its efficiency is not considered. With our result, a new system LSI application with an embedded power source can be explored for the ubiquitous computing era.|||2003
313|||A 300-µW 1.9-GHz CMOS oscillator utilizing micromachined resonators|||A low-power low-phase-noise 1.9-GHz RF oscillator is presented. The oscillator employs a single thin-film bulk acoustic wave resonator and was implemented in a standard 0.18-µm CMOS process. This paper addresses design issues involved in codesigning micromachined resonators with CMOS circuitry to realize ultralow-power RF transceiver components. The oscillator achieves a phase-noise performance of -100 dBc/Hz at 10-kHz offset, -120 dBc/Hz at 100-kHz offset, and -140 dBc/Hz at 1-MHz offset. The startup time of the oscillator is less than 1 µs. The oscillator core consumes 300 µA from a 1-V supply.|||2003
314|||Design and fabrication of a new vibration-based electromechanical power generator|||A device is described for generating electrical power from mechanical energy in a vibrating environment. The design utilises an electromagnetic transducer and its operating principle is based on the relative movement of a magnet pole with respect to a coil.The approach is suitable for embedded remote microsystems structures with no physical links to the outside world. Simulation,modelling and test results following fabrication of a first prototype have demonstrated that generation of practical mounts of power within a reasonable space is possible. Power generation of more than 1 mW within a volume of 240 mm3 at a vibration frequency of 320 Hz has been obtained.|||2001
316|||Towards a Piezoelectric Vibration Powered Microgenerator|||As MEMS and Smart Material technologies advance, embedded and remote applications are becoming more widespread. Powering these systems can be a significant engineering problem, as traditional solutions such as batteries are not always appropriate. An inertial generator is developed that uses thick-film piezoelectric technologies to produce electrical power from vibrations in the environment of the device. The device validates the concept, and produces an output of 3 µW. Predictions show that orders of magnitude increase in power output are possible|||2001
317|||Optimized Piezoelectric Energy Harvesting Circuit Using Step-Down Converter in Discontinuous Conduction Mode|||An optimized method of harvesting vibrational energy with a piezoelectric element using a step-down DC-DC converter is presented. In this configuration, the converter regulates the power flow from the piezoelectric element to the desired electronic load. Analysis of the converter in discontinuous current conduction mode results in an expression for the duty cycle-power relationship. Using parameters of the mechanical system, the piezoelectric element," and the converter; the""optimal"" duty cycle can be determined where the harvested power is maximized for the level of mechanical excitation. It is shown that", as the magnitude of the mechanical excitation increases, the optimal duty cycle becomes essentially constant, greatly simplifying the control of the step-down converter. The expression is validated with experimental data showing that the optimal duty cycle can be accurately determined and maximum energy harvesting attained. A circuit is proposed which implements this relationship, and experimental results show that the converter increases the harvested power by approximately 325%.|||2003
318|||Toward self-tuning adaptive vibration-based microgenerators|||he rapidly decreasing size, cost, and power consumption of wireless sensors has opened up the relatively new research field of energy harvesting. Recent years have seen an increasing amount of research on using ambient vibrations as a power source. An important feature of all of these generators is that they depend on the resonance frequency of the generator device being matched with the frequency of the input vibrations. The goal of this paper, therefore," is to explore solutions to the problem of self-tuning vibration based energy harvesters. A distinction is made between ""active"" tuning actuators that must continuously supply power to achieve the resonance frequency change"," and ""passive"" tuning actuators that supply power initially to tune the frequency"," and then are able to ""turn off"" while maintaining the new resonance frequency. This paper analyzes the feasibility of tuning the resonance frequency of vibration based generators with ""active"" tuning actuators. Actuators that can tune the effective stiffness", mass, and damping are analyzed theoretically. Numerical results based for each type of actuator are presented. It is shown that only actuators that tune the effective damping will result in a net increase in power output, and only under the circumstance that no actuation power is needed to add damping. The net increase in power occurs when the mismatch between driving vibrations the mismatch between driving vibrations the resonance frequency of the device is more than 5%. Finally," the theory and numerical results are validated by experiments done on a piezoelectric generator with a smart material ""active"" tuning actuator.|||2004
319|||Can a Coupling Coefficient of a Piezoelectric Device be Higher Than Those of Its Active Material?|||An electromechanical coupling coefficient is a measure of the effectiveness with which a piezoelectric material (or a device employing such a material) converts the energy in an imposed electrical signal to mechanical energy, or vice versa. There are different kinds of material and device coupling coefficients, corresponding to different modes of excitation and response. Device coupling coefficients are properties of the device and, although related to the material coupling coefficients, are generally different from them. It is commonly held that a device coupling coefficient cannot be greater than some corresponding coupling coefficient of the active material used in the device. A class of devices was recently identified in which the apparent coupling coefficient can, in principle, approach 1.0, which corresponds to the limit of perfect electromechanical energy conversion. The key feature of this class of devices is the use of destabilizing mechanical pre-loads to counter inherent stiffness. The approach is illustrated for a symmetric piezoelectric bimorph device: theory predicts a smooth increase of the apparent coupling coefficient with pre-load, approaching 1.0 at the buckling load. An experiment verified the trend of increasing coupling with pre-load: a load corresponding to 50% of the buckling load increased the bimorph coupling coefficient by more than 40%. This approach provides a way to simultaneously increase both the operating displacement and force of a piezoelectric device, distinguishing it from alternatives such as motion amplification. and may allow transducer designers to achieve substantial performance gains for some actuator and sensor devices.|||1997
41|||Controller parametric robustification using observer-based formulation and multimodel design technique|||This note deals with controller robustification using equivalent observer based structure. The purpose of the method is to improve the parametric robustness of an initial controller, synthesized, for example, by using the LQ,H8, or µ technique. The method uses equivalent Luenberger observer formulation and multimodel design procedure for the parametric robustification. First, the initial controller is put under equivalent observer structure. Second, from this observer-based formulation, the controller is reshaped to increase the parametric robustness without paying attention to the closed-loop poles coming from the controller dynamics. Note that during this step, changes in the controller initial performances are minimized. Another advantage of the equivalent observer based formulation lies with the fact that it could directly be used to schedule the controller (dynamic and feedback parts). Finally, the global method (equivalent observer plus robustification) is applied on the robust control of the space shuttle described in µ-analysis and synthesis toolbox.|||2005
411|||Gain scheduling dynamic linear controllers for a nonlinear plant|||For a general type of nonlinear tracking problem, we consider gain scheduling based on a family of linear dynamic controllers designed for a family of plant linearizations about constant operating points. A necessary and sufficient condition for the existence of gain scheduled controllers satisfying appropriate requirements is presented. Using this condition, the impact of linear controller configuration on the existence of a gain scheduled controller can be assessed, and ad hoc approaches to scheduling can be analyzed|||1995
412|||Compensator synthesis using (C,A,"B)-pairs|||This paper gives a general framework (in the geometric style) for the design of compensators for linear multivariable systems. Basic is the notion of a ""(C",A,"B)-pair of subspaces."" This concept is newly defined here"," and we give its simplest application (to the problem of disturbance decoupling by observation feedback). We then formulate a general compensator synthesis principle and show how several well-known synthesis techniques can be derived from it. We also show that ""almost all"" compensators can be interpreted as observer-based compensators", and discuss the relation between the compensator problem and the stable cover problem|||1980
413|||Computing the estimator-controller form of a compensator|||A technique is presented for finding the estimator and controller gains to implement a desired compensator in estimator-controller form. The technique is derived by mapping the states of the compensator to those of the estimator-controller via a linear transformation. Using the technique involves finding the real invertible solutions of a non-symmetric steady-state matrix Riccati equation. The Ricatti equation may have zero, two or more real invertible solutions. From each solution a set of estimator and controller gains can be computed. Multiple solutions correspond to the freedom to choose which closed-loop system poles are associated with the controller and which are associated with the estimator. This technique can be applied to multi-input multi-output systems. In an example, the technique is applied to the despin, control system of a dual-spin satellite.|||1985
414|||Exact Observer-Based Structures for Arbitrary Compensators|||n this paper, some new techniques for determining the observer-based or LQG form of any compensator with arbitrary order are discussed. The practical appeal of such techniques is that they allow for a simplied implementation and reduced memory storage of general controllers and offer additional flexibility for handling gain-scheduling and input saturation constraints as compensator states become meaningful variables. The derived observer-based controllers are input-output equivalent to the original controller but with an explicit separated estimation/control structure. Such structures involve both static control and estimation gains with an extra Youla parameter that can be either static or dynamic. The proposed techniques are applicable both in continuous and discrete-time, to full-order controllers, that is, controllers whose order is the same as the plant's order but also to augmented- and reduced-order controllers whose orders are greater or smaller, respectively. Necessary conditi...|||1999
415|||A multimodel-based approach to robust and self-scheduled control design|||This paper presents a design technique that aims at “flattening” the real-µ-curve corresponding to a given initial feedback by combining µ-analysis and multimodel design. µ-analysis is used sequential to detect worst cases. Multimodel design is used for treating simultaneously the set of worst cases. The resulting controller can be nonscheduled or scheduled with respect to measured (slowly) varying parameters. This paper is mostly devoted to multimodel design. The multimodel design problem is written in terms of eigenstructure assignment. Two classes of resolution techniques are presented: first, the dynamic feedback is written in a transfer matrix form, second, it is written as an observer structure|||1998
416|||Gain scheduling dynamic linear controllers for a nonlinear plant|||For a general type of nonlinear tracking problem, we consider gain scheduling based on a family of linear dynamic controllers designed for a family of plant linearizations about constant operating points. A necessary and sufficient condition for the existence of gain scheduled controllers satisfying appropriate requirements is presented. Using this condition, the impact of linear controller configuration on the existence of a gain scheduled controller can be assessed, and ad hoc approaches to scheduling can be analyzed.|||1995
417|||The application of scheduled ${H}_{\infty}$ controllers to a vstol aircraft|||The authors apply H8-designed controllers to a generic VSTOL (vertical and short takeoff and landing) aircraft model GVAM. The design study motivates the use of H 8 techniques, and addresses some of the implementation issues which arise for multivariable and H8-designed controllers. An approach for gain scheduling H8 controllers on the basis of the normalized comprime factor robust stabilization problem formulation used for the H8 design is developed. It utilizes the observer structure unique to this particular robustness optimization. A weighting selection procedure, has been developed for the associated loop-shaping technique used to specify performance. Multivariable controllers pose additional problems in the event of actuator saturations, and a desaturation scheme which accounts for this is applied to the GVAM. A comprehensive control law was developed and evaluated using the Royal Aerospace Establishment piloted simulation facility|||1993
418|||An observer based multimodel control design approach|||The classical eigenstructure assignment technique, generally does not lead to satisfactory robustness. This paper presents a new eigenstructure assignment technique that permits the designer to treat several systems simultaneously, and therefore to meet robustness requirements. Redundancy between measurem ents and observed variables is used to solve eigenstructure assignment equations for several models.|||1999
419|||Tools for flight control robustness assessment Évaluation de la robustesse de lois de pilotage avec les outils de µ-analyse|||The aim of this paper is to emphasize the usefulness of the µ framework for the analysis of the robustness properties of flight control systems. Model uncertainties may correspond, either to parametric uncertainties (e.g. in the aerodynamic model or in the value of the trim point) or to neglected high frequency dynamics (e.g. in the actuators or sensors). We especially show that several classical problems (computation of a phase or delay margin, non-linear analysis of a PIO effect, computation of a frequency domain overshoot) can be extended to an uncertain aircraft model. A flexible model of the aircraft can, moreover, be taken into account.|||1999
42|||Dirac structures and Boundary Control Systems associated with Skew-Symmetric Differential Operators|||Associated with a skew-symmetric linear operator on the spatial domain $[a,b]$ we define a Dirac structure which includes the port variables on the boundary of this spatial domain. This Dirac structure is a subspace of a Hilbert space. Naturally, associated with this Dirac structure is an infinite-dimensional system. We parameterize the boundary port variables for which the \( C_{0} \)-semigroup associated with this system is contractive or unitary. Furthermore, this parameterization is used to split the boundary port variables into inputs and outputs. Similarly, we define a linear port controlled Hamiltonian system associated with the previously defined Dirac structure and a symmetric positive operator defining the energy of the system. We illustrate this theory on the example of the Timoshenko beam|||2005
1|||Continuous Representations of Time-Series Gene Expression Data|||We present algorithms for time-series gene expression analysis that permit the principled estimation of unobserved time-points, clustering, and dataset alignment. Each expression profile is modeled as a cubic spline (piecewise polynomial) that is estimated from the observed data and every time point influences the overall smooth expression curve. We constrain the spline coefficients of genes in the same class to have similar expression patterns, while also allowing for gene specific parameters. We show that unobserved time-points can be reconstructed using our method with 10-15% less error when compared to previous best methods. Our clustering algorithm operates directly on the continuous representations of gene expression profiles, and we demonstrate that this is particularly effective when applied to non- uniformly sampled data. Our continuous alignment algorithm also avoids difficulties encountered by discrete approaches. In particular, our method allows for control of the number of degrees of freedom of the warp through the specification of parameterized functions, which helps to avoid overfitting. We demonstrate that our algorithm produces stable low-error alignments on real expression data and further show a specific application to yeast knockout data that produces biologically meaningful results.|||2003
2|||Evaluation of normalization methods for microarray data|||Background: Microarray technology allows the monitoring of expression levels for thousands of genes simultaneously. This novel technique helps us to understand gene regulation as well as gene by gene interactions more systematically. In the microarray experiment, however, many undesirable systematic variations are observed. Even in replicated experiment, some variations are commonly observed. Normalization is the process of removing some sources of variation which affect the measured gene expression levels. Although a number of normalization methods have been proposed, it has been difficult to decide which methods perform best. Normalization plays an important role in the earlier stage of microarray data analysis. The subsequent analysis results are highly dependent on normalization. Results: In this paper, we use the variability among the replicated slides to compare performance of normalization methods. We also compare normalization methods with regard to bias and mean square error using simulated data. Conclusions: Our results show that intensity-dependent normalization often performs better than global normalization methods, and that linear and nonlinear normalization methods perform similarly. These conclusions are based on analysis of 36 cDNA microarrays of 3,840 genes obtained in an experiment to search for changes in gene expression profiles during neuronal differentiation of cortical stem cells. Simulation studies confirm our findings.|||2003
3|||The FunCat, a functional annotation scheme for systematic classification of proteins from whole genomes|||In this paper, we present the Functional Catalogue (FunCat), a hierarchically structured, organism- independent, flexible and scalable controlled classi- fication system enabling the functional description of proteins from any organism. FunCat has been applied for the manual annotation of prokaryotes, fungi, plants and animals. We describe how FunCat is implemented as a highly efficient and robust tool for the manual and automatic annotation of genomic sequences. Owing to its hierarchical architecture, FunCat has also proved to be useful for many subse- quent downstream bioinformatic applications. This is illustrated by the analysis of large-scale experiments from various investigations in transcriptomics and proteomics, where FunCat was used to project experi- mental data into functional units, as 'gold standard' for functional classification methods, and also served to compare the significance of different experimental methods. Over the last decade, the FunCat has been established as a robust and stable annotation scheme that offers both, meaningful and manageable func- tional classification as well as ease of perception.|||2004
4|||Disruption of Yeast Forkhead-associated Cell Cycle Transcription by Oxidative Stress|||The effects of oxidative stress on yeast cell cycle depend on the stress-exerting agent. We studied the effects of two oxidative stress agents, hydrogen peroxide (HP) and the superoxide-generating agent Menadione (MD). We found that two small co-expressed groups of genes regulated by the Mcm1-Fkh2-Ndd1 transcription regulatory complex are sufficient to account for the difference in the effects of HP and MD on the progress of the cell cycle, namely G1 arrest with MD and an S phase delay followed by a G2/M arrest with HP. Support for this hypothesis is provided by fkh1fkh2 double mutants, which are affected by MD as we find HP affects wild type cells. The apparent involvement of a forkhead protein in HP-induced cell cycle arrest, similar to that reported for C. elegans and human, describes a potentially novel stress-response pathway in yeast.|||2004
